Campaign Name,Campaign ID,Domain,Number of Keywords,Campaign Keywords,Mapping-ID,Optional Field 1,Optional Field 2,Optional Field 3,Optional Field 4fiaalbania.org - 20,,fiaalbania.org,20,fiaalbania.org,fiaalbania.org,Foreign investors,"Business, Finance, Travel & Tourism","Benefits to economy, common products and services traded",flagstaffchamber.org - 20,,flagstaffchamber.org,20,flagstaffchamber.org,flagstaffchamber.org,"Small Businesses, Big Businesses ","Business, Finance, Spending","Big vs small, corporate vs. private, pros and cons",frentesolidario.org - 20,,frentesolidario.org,20,frentesolidario.org,frentesolidario.org,Free Trade Protection,"Business, Finance, Entrepreneurs, Free Trade","Importance of, benefits of, processes and procedures",homschamber.org - 20,,homschamber.org,20,homschamber.org,homschamber.org,Building a Business,"Business, Finance","Loans, risks, insurance, traning",howtojoinacu.org - 20,,howtojoinacu.org,20,howtojoinacu.org,howtojoinacu.org,Credit Unions,"Finance, Business, Banking, Loans","Benefits, banks vs. credit union, government involvment",