eBay URL,Google search URL,Product Title
http://catalog.ebay.com/114489045,http://www.google.com/search?q=Sentry 880CD Over the Head Headphones,Sentry 880CD Over the Head Headphones
http://catalog.ebay.com/114481922,http://www.google.com/search?q=Sennheiser RI 100-A In-Ear Wireless Headphones,Sennheiser RI 100-A In-Ear Wireless Headphones
http://catalog.ebay.com/114454394,http://www.google.com/search?q=Williams Sound EAR022 In-Ear Headphones,Williams Sound EAR022 In-Ear Headphones
http://catalog.ebay.com/114541513,http://www.google.com/search?q=Digital Blue DIB-685 Over the Head Headphones,Digital Blue DIB-685 Over the Head Headphones
http://catalog.ebay.com/114515177,http://www.google.com/search?q=Audiovox HP817 Headphones,Audiovox HP817 Headphones
http://catalog.ebay.com/114496906,http://www.google.com/search?q=Velleman HPD10 Headphones,Velleman HPD10 Headphones
http://catalog.ebay.com/114559508,http://www.google.com/search?q=Philips SWS8000/00 In-Ear Headphones,Philips SWS8000/00 In-Ear Headphones
http://catalog.ebay.com/114481992,http://www.google.com/search?q=Sennheiser MX 160 Black In-Ear Headphones,Sennheiser MX 160 Black In-Ear Headphones
http://catalog.ebay.com/114455244,http://www.google.com/search?q=Nike SBS-HJ050 Headphones,Nike SBS-HJ050 Headphones
http://catalog.ebay.com/114544773,http://www.google.com/search?q=Philips SHE255/00 In-Ear Headphones,Philips SHE255/00 In-Ear Headphones
http://catalog.ebay.com/114555918,http://www.google.com/search?q=Philips SHP2700/00 Over the Head Headphones,Philips SHP2700/00 Over the Head Headphones
http://catalog.ebay.com/114556608,http://www.google.com/search?q=Alienware PC Systems Ozma 5 Over the Head Headphones,Alienware PC Systems Ozma 5 Over the Head Headphones
http://catalog.ebay.com/114541343,http://www.google.com/search?q=Panasonic SLIMZ RP-HX50 Over the Head Headphones,Panasonic SLIMZ RP-HX50 Over the Head Headphones
http://catalog.ebay.com/114482672,http://www.google.com/search?q=Philips SHS8001/00 Over the Head Headphones,Philips SHS8001/00 Over the Head Headphones
http://catalog.ebay.com/114496966,http://www.google.com/search?q=Maxell MMS Orange In-Ear Headphones,Maxell MMS Orange In-Ear Headphones
http://catalog.ebay.com/114485632,http://www.google.com/search?q=Scosche Industries HZ5 Over the Head Wireless Headphones,Scosche Industries HZ5 Over the Head Wireless Headphones
http://catalog.ebay.com/114518937,http://www.google.com/search?q=Hama ME-458 In-Ear Headphones,Hama ME-458 In-Ear Headphones
http://catalog.ebay.com/114498099,http://www.google.com/search?q=Sennheiser RS 2400 In-Ear Wireless Headphones,Sennheiser RS 2400 In-Ear Wireless Headphones
http://catalog.ebay.com/114541323,http://www.google.com/search?q=Philips SHE785/00 In-Ear Headphones,Philips SHE785/00 In-Ear Headphones
http://catalog.ebay.com/114485812,http://www.google.com/search?q=Shure 270160 Wireless Headphones,Shure 270160 Wireless Headphones
http://catalog.ebay.com/114496736,http://www.google.com/search?q=Plantronics GSA91-0101 Headphones,Plantronics GSA91-0101 Headphones
http://catalog.ebay.com/114500956,http://www.google.com/search?q=Jensen JTH980 Over the Head Headphones,Jensen JTH980 Over the Head Headphones
http://catalog.ebay.com/114489925,http://www.google.com/search?q=Office Depot AMH-4400 Headphones,Office Depot AMH-4400 Headphones
http://catalog.ebay.com/114498139,http://www.google.com/search?q=V-Moda V2M Headphones,V-Moda V2M Headphones
http://catalog.ebay.com/114500556,http://www.google.com/search?q=Sennheiser Set 840-TV In-Ear Wireless Headphones,Sennheiser Set 840-TV In-Ear Wireless Headphones
http://catalog.ebay.com/114515697,http://www.google.com/search?q=Magnavox MHE1500 In-Ear Headphones,Magnavox MHE1500 In-Ear Headphones
http://catalog.ebay.com/114560388,http://www.google.com/search?q=Dynex DX202 Over the Head Headphones,Dynex DX202 Over the Head Headphones
http://catalog.ebay.com/114556448,http://www.google.com/search?q=Canyon CNR-EP1 In-Ear Headphones,Canyon CNR-EP1 In-Ear Headphones
http://catalog.ebay.com/114455154,http://www.google.com/search?q=Panasonic RP-HJE900 In-Ear Headphones,Panasonic RP-HJE900 In-Ear Headphones
http://catalog.ebay.com/114452951,http://www.google.com/search?q=Altec Lansing MHP111 In-Ear Headphones,Altec Lansing MHP111 In-Ear Headphones
http://catalog.ebay.com/114489745,http://www.google.com/search?q=Jensen JHB507 In-Ear Headphones,Jensen JHB507 In-Ear Headphones
http://catalog.ebay.com/114456561,http://www.google.com/search?q=Compucessory CCS 59355 In-Ear Headphones,Compucessory CCS 59355 In-Ear Headphones
http://catalog.ebay.com/114500966,http://www.google.com/search?q=ILuv i301 Pink In-Ear Headphones,ILuv i301 Pink In-Ear Headphones
http://catalog.ebay.com/114519477,http://www.google.com/search?q=Canyon CNR-EP5 In-Ear Headphones,Canyon CNR-EP5 In-Ear Headphones
http://catalog.ebay.com/114453101,http://www.google.com/search?q=Philips SHJ035/27 Over the Head Headphones,Philips SHJ035/27 Over the Head Headphones
http://catalog.ebay.com/114482572,http://www.google.com/search?q=Sony MDR-Q38LW Light Blue In-Ear Headphones,Sony MDR-Q38LW Light Blue In-Ear Headphones
http://catalog.ebay.com/114490015,http://www.google.com/search?q=Panasonic RP-HT265E Over the Head Headphones,Panasonic RP-HT265E Over the Head Headphones
http://catalog.ebay.com/114453121,http://www.google.com/search?q=Philips SHE136027 In-Ear Headphones,Philips SHE136027 In-Ear Headphones
http://catalog.ebay.com/114451574,http://www.google.com/search?q=Skullcandy Asym Black In-Ear Headphones,Skullcandy Asym Black In-Ear Headphones
http://catalog.ebay.com/114560408,http://www.google.com/search?q=Haier VHP10 In-Ear Headphones,Haier VHP10 In-Ear Headphones
http://catalog.ebay.com/114519787,http://www.google.com/search?q=nutro products NC5 Headphones,nutro products NC5 Headphones
http://catalog.ebay.com/114556498,http://www.google.com/search?q=Creative HQ-2300D Over the Head Headphones,Creative HQ-2300D Over the Head Headphones
http://catalog.ebay.com/114486222,http://www.google.com/search?q=H2O Audio H3-5A3 Behind The Ear Headphones,H2O Audio H3-5A3 Behind The Ear Headphones
http://catalog.ebay.com/114451404,http://www.google.com/search?q=Goldring DR50 Over the Head Headphones,Goldring DR50 Over the Head Headphones
http://catalog.ebay.com/114486295,http://www.google.com/search?q=Pioneer SE-L40 Over the Head Headphones,Pioneer SE-L40 Over the Head Headphones
http://catalog.ebay.com/114560778,http://www.google.com/search?q=Trisonic TS-YK3000 Over the Head Headphones,Trisonic TS-YK3000 Over the Head Headphones
http://catalog.ebay.com/114450211,http://www.google.com/search?q=Philips SHJ070 Behind the Neck Headphones,Philips SHJ070 Behind the Neck Headphones
http://catalog.ebay.com/114529750,http://www.google.com/search?q=Kenwood KH-K1000 Over the Head Headphones,Kenwood KH-K1000 Over the Head Headphones
http://catalog.ebay.com/114455464,http://www.google.com/search?q=Philips SBCHJ030 Behind The Ear Headphones,Philips SBCHJ030 Behind The Ear Headphones
http://catalog.ebay.com/114482872,http://www.google.com/search?q=Sentry HO415 Over the Head Headphones,Sentry HO415 Over the Head Headphones
http://catalog.ebay.com/114451684,http://www.google.com/search?q=Philips SHD8900 Over the Head Wireless Headphones,Philips SHD8900 Over the Head Wireless Headphones
http://catalog.ebay.com/114453791,http://www.google.com/search?q=ILuv i913 Over the Head Headphones,ILuv i913 Over the Head Headphones
http://catalog.ebay.com/114501236,http://www.google.com/search?q=Maxell Encore EN-2 Over the Head Headphones,Maxell Encore EN-2 Over the Head Headphones
http://catalog.ebay.com/114542103,http://www.google.com/search?q=Maxell Juicy Tunes Purple In-Ear Headphones,Maxell Juicy Tunes Purple In-Ear Headphones
http://catalog.ebay.com/114538683,http://www.google.com/search?q=Pyle PEBH25BK In-Ear Headphones,Pyle PEBH25BK In-Ear Headphones
http://catalog.ebay.com/114539063,http://www.google.com/search?q=Aiwa HP-AJ122 Behind the Neck Headphones,Aiwa HP-AJ122 Behind the Neck Headphones
http://catalog.ebay.com/114455474,http://www.google.com/search?q=jWIN JH-P30 Over the Head Headphones,jWIN JH-P30 Over the Head Headphones
http://catalog.ebay.com/114542323,http://www.google.com/search?q=Maxell Juicy Tunes Blue In-Ear Headphones,Maxell Juicy Tunes Blue In-Ear Headphones
http://catalog.ebay.com/114497356,http://www.google.com/search?q=Maxell Cool Beans Red In-Ear Headphones,Maxell Cool Beans Red In-Ear Headphones
http://catalog.ebay.com/114525720,http://www.google.com/search?q=Philips SHS4847 Behind The Ear Headphones,Philips SHS4847 Behind The Ear Headphones
http://catalog.ebay.com/114560548,http://www.google.com/search?q=Creative HQ-1300 Over the Head Headphones,Creative HQ-1300 Over the Head Headphones
http://catalog.ebay.com/114451794,http://www.google.com/search?q=Philips SBC-HP430 Over the Head Headphones,Philips SBC-HP430 Over the Head Headphones
http://catalog.ebay.com/114483202,http://www.google.com/search?q=Logitech 980397 Wireless Headphones,Logitech 980397 Wireless Headphones
http://catalog.ebay.com/114495299,http://www.google.com/search?q=Sennheiser OMX 50 VC Street Behind The Ear Headphones,Sennheiser OMX 50 VC Street Behind The Ear Headphones
http://catalog.ebay.com/114486375,http://www.google.com/search?q=Sony MDR-E11LPL In-Ear Headphones,Sony MDR-E11LPL In-Ear Headphones
http://catalog.ebay.com/114494719,http://www.google.com/search?q=Polaroid PEP36BLK In-Ear Headphones,Polaroid PEP36BLK In-Ear Headphones
http://catalog.ebay.com/114490185,http://www.google.com/search?q=Califone International 3060AV Over the Head Headphones,Califone International 3060AV Over the Head Headphones
http://catalog.ebay.com/114556848,http://www.google.com/search?q=Omnitronic CHEVROLET COBALT COUPE Over the Head Headphones,Omnitronic CHEVROLET COBALT COUPE Over the Head Headphones
http://catalog.ebay.com/114456104,http://www.google.com/search?q=Sony MDR-Q33LP Black Over the Head Headphones,Sony MDR-Q33LP Black Over the Head Headphones
http://catalog.ebay.com/114449701,http://www.google.com/search?q=V-Moda Vibe V-BLACKCHROME Headphones,V-Moda Vibe V-BLACKCHROME Headphones
http://catalog.ebay.com/114490895,http://www.google.com/search?q=Maxell HB-350F Brown Over the Head Headphones,Maxell HB-350F Brown Over the Head Headphones
http://catalog.ebay.com/114451834,http://www.google.com/search?q=Sennheiser MXL 70 In-Ear Headphones,Sennheiser MXL 70 In-Ear Headphones
http://catalog.ebay.com/114526440,http://www.google.com/search?q=Sony MDR-E560G In-Ear Headphones,Sony MDR-E560G In-Ear Headphones
http://catalog.ebay.com/114483752,http://www.google.com/search?q=jWIN iEP313RED Headphones,jWIN iEP313RED Headphones
http://catalog.ebay.com/114453441,http://www.google.com/search?q=Memorex EB200A In-Ear Headphones,Memorex EB200A In-Ear Headphones
http://catalog.ebay.com/114501816,http://www.google.com/search?q=Fischer Audio Silver Bullet Headphones,Fischer Audio Silver Bullet Headphones
http://catalog.ebay.com/114452144,http://www.google.com/search?q=Altec Lansing MUZX Ultra MZX606 In-Ear Headphones,Altec Lansing MUZX Ultra MZX606 In-Ear Headphones
http://catalog.ebay.com/114501126,http://www.google.com/search?q=Sennheiser OMX80 Sport II Behind The Ear Headphones,Sennheiser OMX80 Sport II Behind The Ear Headphones
http://catalog.ebay.com/114486555,http://www.google.com/search?q=Sony DE45EA Over the Head Headphones,Sony DE45EA Over the Head Headphones
http://catalog.ebay.com/114450601,http://www.google.com/search?q=dbi Pro 700 Over the Head Headphones,dbi Pro 700 Over the Head Headphones
http://catalog.ebay.com/114453501,http://www.google.com/search?q=Panasonic RP-HV298K In-Ear Headphones,Panasonic RP-HV298K In-Ear Headphones
http://catalog.ebay.com/114486565,http://www.google.com/search?q=Panasonic RP-HS79S Behind The Ear Headphones,Panasonic RP-HS79S Behind The Ear Headphones
http://catalog.ebay.com/114497596,http://www.google.com/search?q=Acoustic Research AW791 Over the Head Wireless Headphones,Acoustic Research AW791 Over the Head Wireless Headphones
http://catalog.ebay.com/114497566,http://www.google.com/search?q=Labtec Elite 835 Over the Head Headphones,Labtec Elite 835 Over the Head Headphones
http://catalog.ebay.com/114455584,http://www.google.com/search?q=Audiovox JF-40 Over the Head Headphones,Audiovox JF-40 Over the Head Headphones
http://catalog.ebay.com/114516247,http://www.google.com/search?q=jWIN iLuv i201 Over the Head Headphones,jWIN iLuv i201 Over the Head Headphones
http://catalog.ebay.com/114455924,http://www.google.com/search?q=V-Moda Bass Freq Tambarine Orange In-Ear Headphones,V-Moda Bass Freq Tambarine Orange In-Ear Headphones
http://catalog.ebay.com/114491189,http://www.google.com/search?q=Polaroid PEP37ORG In-Ear Headphones,Polaroid PEP37ORG In-Ear Headphones
http://catalog.ebay.com/114513527,http://www.google.com/search?q=Polaroid PEP37GRN In-Ear Headphones,Polaroid PEP37GRN In-Ear Headphones
http://catalog.ebay.com/114495609,http://www.google.com/search?q=Sennheiser HDR 180 Over the Head Wireless Headphones,Sennheiser HDR 180 Over the Head Wireless Headphones
http://catalog.ebay.com/114456324,"http://www.google.com/search?q=Motorola UNIHFEB for L7082, L7089, P7382, P7389 Headphones","Motorola UNIHFEB for L7082, L7089, P7382, P7389 Headphones"
http://catalog.ebay.com/114542303,http://www.google.com/search?q=Philips SHE9750 In-Ear Headphones,Philips SHE9750 In-Ear Headphones
http://catalog.ebay.com/114561028,http://www.google.com/search?q=Sennheiser HDR 170 Over the Head Wireless Headphones,Sennheiser HDR 170 Over the Head Wireless Headphones
http://catalog.ebay.com/114516327,http://www.google.com/search?q=Chicbuds RBRB Headphones,Chicbuds RBRB Headphones
http://catalog.ebay.com/114490385,http://www.google.com/search?q=Cortex CHP-2500 Over the Head Headphones,Cortex CHP-2500 Over the Head Headphones
http://catalog.ebay.com/114491199,http://www.google.com/search?q=iHome iHMP5 Red Over the Head Headphones,iHome iHMP5 Red Over the Head Headphones
http://catalog.ebay.com/114543043,http://www.google.com/search?q=ILuv TEP201RED In-Ear Headphones,ILuv TEP201RED In-Ear Headphones
http://catalog.ebay.com/114561368,http://www.google.com/search?q=Roadview CDC-IR10 Over the Head Headphones,Roadview CDC-IR10 Over the Head Headphones
http://catalog.ebay.com/114492049,http://www.google.com/search?q=Lenntek 001-0803-001 In-Ear Headphones,Lenntek 001-0803-001 In-Ear Headphones
http://catalog.ebay.com/114501266,http://www.google.com/search?q=Iblink BLW1 In-Ear Headphones,Iblink BLW1 In-Ear Headphones
http://catalog.ebay.com/114494929,http://www.google.com/search?q=Roadview RW-IR2 Over the Head Wireless Headphones,Roadview RW-IR2 Over the Head Wireless Headphones
http://catalog.ebay.com/114561388,http://www.google.com/search?q=Philips SHK2010/00 Behind the Neck Headphones,Philips SHK2010/00 Behind the Neck Headphones
http://catalog.ebay.com/114453641,http://www.google.com/search?q=JL Audio JB2140 In-Ear Headphones,JL Audio JB2140 In-Ear Headphones
http://catalog.ebay.com/114491085,http://www.google.com/search?q=Altec Lansing MZX126W Headphones,Altec Lansing MZX126W Headphones
http://catalog.ebay.com/114452134,http://www.google.com/search?q=Sony MDR-EX80 In-Ear Headphones,Sony MDR-EX80 In-Ear Headphones
http://catalog.ebay.com/114560828,http://www.google.com/search?q=Grado HF-2 Over the Head Headphones,Grado HF-2 Over the Head Headphones
http://catalog.ebay.com/114494959,http://www.google.com/search?q=Merkury Innovations M-HR100 Over the Head Headphones,Merkury Innovations M-HR100 Over the Head Headphones
http://catalog.ebay.com/114491299,http://www.google.com/search?q=Hyundai CJC-E102 Headphones,Hyundai CJC-E102 Headphones
http://catalog.ebay.com/114557818,http://www.google.com/search?q=Skullcandy Titan Rasta/Green/Red In-Ear Headphones,Skullcandy Titan Rasta/Green/Red In-Ear Headphones
http://catalog.ebay.com/114452074,http://www.google.com/search?q=Sony MDR-E9LP Gray In-Ear Headphones,Sony MDR-E9LP Gray In-Ear Headphones
http://catalog.ebay.com/114452224,http://www.google.com/search?q=Able Planet NC200B TRUE FIDELITY Black Over the Head Headphones,Able Planet NC200B TRUE FIDELITY Black Over the Head Headphones
http://catalog.ebay.com/114452894,http://www.google.com/search?q=Audio-Technica Solid Bass ATH-CKS70 In-Ear Headphones,Audio-Technica Solid Bass ATH-CKS70 In-Ear Headphones
http://catalog.ebay.com/114487655,http://www.google.com/search?q=Able Planet EXTREME XNC230 Green Over the Head Headphones,Able Planet EXTREME XNC230 Green Over the Head Headphones
http://catalog.ebay.com/114491359,http://www.google.com/search?q=Philips SHN5200 Over the Head Headphones,Philips SHN5200 Over the Head Headphones
http://catalog.ebay.com/114453711,http://www.google.com/search?q=Panasonic RP-HJE280 Orange In-Ear Headphones,Panasonic RP-HJE280 Orange In-Ear Headphones
http://catalog.ebay.com/114530340,http://www.google.com/search?q=Shure SRH550DJ Over the Head Headphones,Shure SRH550DJ Over the Head Headphones
http://catalog.ebay.com/114497856,http://www.google.com/search?q=Able Planet TRUE FIDELITY NC180CG Over the Head Headphones,Able Planet TRUE FIDELITY NC180CG Over the Head Headphones
http://catalog.ebay.com/114452284,http://www.google.com/search?q=Altec Lansing Muzx Core MZX206 In-Ear Headphones,Altec Lansing Muzx Core MZX206 In-Ear Headphones
http://catalog.ebay.com/114487602,http://www.google.com/search?q=Able Planet NC192B Over the Head Headphones,Able Planet NC192B Over the Head Headphones
http://catalog.ebay.com/114483332,http://www.google.com/search?q=Skullcandy 50/50 Shoe Blue In-Ear Headphones,Skullcandy 50/50 Shoe Blue In-Ear Headphones
http://catalog.ebay.com/114497876,http://www.google.com/search?q=Sony MDR-EX10LP Turquoise Blue In-Ear Headphones,Sony MDR-EX10LP Turquoise Blue In-Ear Headphones
http://catalog.ebay.com/114450901,http://www.google.com/search?q=Sony MDR-ZX300 Black Over the Head Headphones,Sony MDR-ZX300 Black Over the Head Headphones
http://catalog.ebay.com/114456534,http://www.google.com/search?q=Sony DR-PQ7iP Violet In-Ear Headphones,Sony DR-PQ7iP Violet In-Ear Headphones
http://catalog.ebay.com/114486932,http://www.google.com/search?q=Sony DR-PQ7iP Red In-Ear Headphones,Sony DR-PQ7iP Red In-Ear Headphones
http://catalog.ebay.com/114561638,http://www.google.com/search?q=Sony MDR-EX40LP Spicy Red In-Ear Headphones,Sony MDR-EX40LP Spicy Red In-Ear Headphones
http://catalog.ebay.com/114498656,http://www.google.com/search?q=Sony MDR-EX58V Violet In-Ear Headphones,Sony MDR-EX58V Violet In-Ear Headphones
http://catalog.ebay.com/114450931,http://www.google.com/search?q=Panasonic RP-F500 Over the Head Headphones,Panasonic RP-F500 Over the Head Headphones
http://catalog.ebay.com/114495439,http://www.google.com/search?q=Philips SHL800/10 Headphones,Philips SHL800/10 Headphones
http://catalog.ebay.com/114497996,http://www.google.com/search?q=Creative HQ-80 Behind the Neck Headphones,Creative HQ-80 Behind the Neck Headphones
http://catalog.ebay.com/114516437,http://www.google.com/search?q=Wesc WeActivist Love Eneroth Over the Head Headphones,Wesc WeActivist Love Eneroth Over the Head Headphones
http://catalog.ebay.com/114490935,http://www.google.com/search?q=Hama HK-271 In-Ear Headphones,Hama HK-271 In-Ear Headphones
http://catalog.ebay.com/114455784,http://www.google.com/search?q=TDK NC-150 Over the Head Headphones,TDK NC-150 Over the Head Headphones
http://catalog.ebay.com/114517357,http://www.google.com/search?q=Wesc Tony Arcabascio Over the Head Headphones,Wesc Tony Arcabascio Over the Head Headphones
http://catalog.ebay.com/114450131,http://www.google.com/search?q=Sennheiser MXL 570 In-Ear Headphones,Sennheiser MXL 570 In-Ear Headphones
http://catalog.ebay.com/114526540,http://www.google.com/search?q=Panasonic RP-HV21 Berry Red In-Ear Headphones,Panasonic RP-HV21 Berry Red In-Ear Headphones
http://catalog.ebay.com/114530150,http://www.google.com/search?q=Maxell Rhythmz In Ear Headphones White Headphones,Maxell Rhythmz In Ear Headphones White Headphones
http://catalog.ebay.com/114557328,http://www.google.com/search?q=Logitech UE 5 Ambient Headphones,Logitech UE 5 Ambient Headphones
http://catalog.ebay.com/114452244,http://www.google.com/search?q=Philips SHL5003 Over the Head Headphones,Philips SHL5003 Over the Head Headphones
http://catalog.ebay.com/114486945,http://www.google.com/search?q=Thinksound ts02 In-Ear Headphones,Thinksound ts02 In-Ear Headphones
http://catalog.ebay.com/114491909,http://www.google.com/search?q=Philips SHS3211 Behind The Ear Headphones,Philips SHS3211 Behind The Ear Headphones
http://catalog.ebay.com/114542523,http://www.google.com/search?q=Panasonic RP-WF950 Over the Head Wireless Headphones,Panasonic RP-WF950 Over the Head Wireless Headphones
http://catalog.ebay.com/114558048,http://www.google.com/search?q=Philips SHK1600 Over the Head Headphones,Philips SHK1600 Over the Head Headphones
http://catalog.ebay.com/114483482,http://www.google.com/search?q=Sentry HM209 In-Ear Headphones,Sentry HM209 In-Ear Headphones
http://catalog.ebay.com/114542643,http://www.google.com/search?q=Panasonic RP-HS220 Orange Behind The Ear Headphones,Panasonic RP-HS220 Orange Behind The Ear Headphones
http://catalog.ebay.com/114542613,http://www.google.com/search?q=Sony Fontopia MDR-E10LP Blue In-Ear Headphones,Sony Fontopia MDR-E10LP Blue In-Ear Headphones
http://catalog.ebay.com/114502016,http://www.google.com/search?q=Koss UR21v Over the Head Headphones,Koss UR21v Over the Head Headphones
http://catalog.ebay.com/114498016,http://www.google.com/search?q=Koss P7 In-Ear Headphones,Koss P7 In-Ear Headphones
http://catalog.ebay.com/114491489,http://www.google.com/search?q=Koss UR30 Over the Head Headphones,Koss UR30 Over the Head Headphones
http://catalog.ebay.com/114487532,http://www.google.com/search?q=Koss TD61 Over the Head Headphones,Koss TD61 Over the Head Headphones
http://catalog.ebay.com/114526310,http://www.google.com/search?q=Koss TM602 Over the Head Headphones,Koss TM602 Over the Head Headphones
http://catalog.ebay.com/114501756,http://www.google.com/search?q=Koss UR19 Over the Head Headphones,Koss UR19 Over the Head Headphones
http://catalog.ebay.com/114539483,http://www.google.com/search?q=Koss TD65 Over the Head Headphones,Koss TD65 Over the Head Headphones
http://catalog.ebay.com/114526280,http://www.google.com/search?q=Koss KSC15 Behind The Ear Headphones,Koss KSC15 Behind The Ear Headphones
http://catalog.ebay.com/114557448,http://www.google.com/search?q=Koss SportClip Wisconsin Red Behind The Ear Headphones,Koss SportClip Wisconsin Red Behind The Ear Headphones
http://catalog.ebay.com/114517097,http://www.google.com/search?q=Koss 00334B Over the Head Headphones,Koss 00334B Over the Head Headphones
http://catalog.ebay.com/114487085,http://www.google.com/search?q=Koss 00313B Over the Head Headphones,Koss 00313B Over the Head Headphones
http://catalog.ebay.com/114513587,http://www.google.com/search?q=Koss Recovery Over the Head Headphones,Koss Recovery Over the Head Headphones
http://catalog.ebay.com/114498196,http://www.google.com/search?q=Koss KEB70 In-Ear Headphones,Koss KEB70 In-Ear Headphones
http://catalog.ebay.com/114530010,http://www.google.com/search?q=Koss Stratus Over the Head Headphones,Koss Stratus Over the Head Headphones
http://catalog.ebay.com/114502066,http://www.google.com/search?q=Sony MDR-EX57LP Black In-Ear Headphones,Sony MDR-EX57LP Black In-Ear Headphones
http://catalog.ebay.com/114452394,http://www.google.com/search?q=2XL Groove Hanger Bud Killer Whale Black/Chrome Over the Head Headphones,2XL Groove Hanger Bud Killer Whale Black/Chrome Over the Head Headphones
http://catalog.ebay.com/114483732,http://www.google.com/search?q=Sony MDR-EX51SP Silver In-Ear Headphones,Sony MDR-EX51SP Silver In-Ear Headphones
http://catalog.ebay.com/114543173,http://www.google.com/search?q=Sony MDR-EX50LP Gold In-Ear Headphones,Sony MDR-EX50LP Gold In-Ear Headphones
http://catalog.ebay.com/114450441,http://www.google.com/search?q=Sony MDR-Q67LW Black Over the Head Headphones,Sony MDR-Q67LW Black Over the Head Headphones
http://catalog.ebay.com/114487772,http://www.google.com/search?q=Sony MDR-EX20LP White In-Ear Headphones,Sony MDR-EX20LP White In-Ear Headphones
http://catalog.ebay.com/114456144,http://www.google.com/search?q=Sony MDR-EX10LP Pale Pink In-Ear Headphones,Sony MDR-EX10LP Pale Pink In-Ear Headphones
http://catalog.ebay.com/114491739,http://www.google.com/search?q=Sony MDR-EX20LP Blue In-Ear Headphones,Sony MDR-EX20LP Blue In-Ear Headphones
http://catalog.ebay.com/114526900,http://www.google.com/search?q=Sony MDR-EX10LP Green In-Ear Headphones,Sony MDR-EX10LP Green In-Ear Headphones
http://catalog.ebay.com/114492229,http://www.google.com/search?q=Koss KSC22 Silver Green Over the Head Headphones,Koss KSC22 Silver Green Over the Head Headphones
http://catalog.ebay.com/114516867,http://www.google.com/search?q=Sony MDR-ED12LP Silver In-Ear Headphones,Sony MDR-ED12LP Silver In-Ear Headphones
http://catalog.ebay.com/114456864,http://www.google.com/search?q=Sony MDR-E931LP Gold In-Ear Headphones,Sony MDR-E931LP Gold In-Ear Headphones
http://catalog.ebay.com/114495469,http://www.google.com/search?q=Sony MDR-E11LP Black In-Ear Headphones,Sony MDR-E11LP Black In-Ear Headphones
http://catalog.ebay.com/114495489,http://www.google.com/search?q=Sony MDR-Q36LW Pink Over the Head Headphones,Sony MDR-Q36LW Pink Over the Head Headphones
http://catalog.ebay.com/114502196,http://www.google.com/search?q=Skullcandy SCLOWMAC Pink Over the Head Headphones,Skullcandy SCLOWMAC Pink Over the Head Headphones
http://catalog.ebay.com/114454621,http://www.google.com/search?q=Koss 201 Michigan White Over the Head Headphones,Koss 201 Michigan White Over the Head Headphones
