eBay URL,Google search URL,Product Title
http://catalog.ebay.com/115841770,http://www.google.com/search?q=Epson PowerLite 93 Plus Tri-LCD Projector,Epson PowerLite 93 Plus Tri-LCD Projector
http://catalog.ebay.com/115875748,http://www.google.com/search?q=Optoma HD23 DLP Projector,Optoma HD23 DLP Projector
http://catalog.ebay.com/66767110,http://www.google.com/search?q=Toshiba TLP-500 LCD Projector,Toshiba TLP-500 LCD Projector
http://catalog.ebay.com/66744662,http://www.google.com/search?q=Panasonic PT-D56000 DLP Projector,Panasonic PT-D56000 DLP Projector
http://catalog.ebay.com/72043334,http://www.google.com/search?q=Panasonic TH-AE100 LCD Projector,Panasonic TH-AE100 LCD Projector
http://catalog.ebay.com/81983545,http://www.google.com/search?q=Panasonic PT-LC56 LCD Projector,Panasonic PT-LC56 LCD Projector
http://catalog.ebay.com/85994711,http://www.google.com/search?q=Canon LV-7285 LCD Projector,Canon LV-7285 LCD Projector
http://catalog.ebay.com/101953618,http://www.google.com/search?q=Toshiba TLP-T70M LCD Projector,Toshiba TLP-T70M LCD Projector
http://catalog.ebay.com/101889402,http://www.google.com/search?q=Toshiba TLP-T90U Projector,Toshiba TLP-T90U Projector
http://catalog.ebay.com/101895305,http://www.google.com/search?q=Sharp XV-Z910000U Projector,Sharp XV-Z910000U Projector
http://catalog.ebay.com/101925443,http://www.google.com/search?q=Acer P1260 DLP Projector,Acer P1260 DLP Projector
http://catalog.ebay.com/101954018,http://www.google.com/search?q=Polycom ShowStation IP Base system LCD Projector,Polycom ShowStation IP Base system LCD Projector
http://catalog.ebay.com/101889622,http://www.google.com/search?q=RCA EZLINX EZ-SVM-L/R Projector,RCA EZLINX EZ-SVM-L/R Projector
http://catalog.ebay.com/111788378,http://www.google.com/search?q=Hitachi CP-RX52 LCD Projector,Hitachi CP-RX52 LCD Projector
http://catalog.ebay.com/113158869,http://www.google.com/search?q=Panasonic PT-LB20 VE DLP Projector,Panasonic PT-LB20 VE DLP Projector
http://catalog.ebay.com/113567143,http://www.google.com/search?q=Samsung SP-G94 DLP Projector,Samsung SP-G94 DLP Projector
http://catalog.ebay.com/113576258,http://www.google.com/search?q=Digislide STRA-R-01 00 DLP Projector,Digislide STRA-R-01 00 DLP Projector
http://catalog.ebay.com/113856226,http://www.google.com/search?q=Toshiba TLP-S61 Projector,Toshiba TLP-S61 Projector
http://catalog.ebay.com/114768300,http://www.google.com/search?q=NEC LT-380G Projector,NEC LT-380G Projector
http://catalog.ebay.com/114800198,http://www.google.com/search?q=Epson G5650WNL Projector,Epson G5650WNL Projector
http://catalog.ebay.com/114800138,http://www.google.com/search?q=NEC VT 540K Projector,NEC VT 540K Projector
http://catalog.ebay.com/114725412,http://www.google.com/search?q=Christie 38-DSP102 Projector,Christie 38-DSP102 Projector
http://catalog.ebay.com/114729075,http://www.google.com/search?q=Dukane 8920H Projector,Dukane 8920H Projector
http://catalog.ebay.com/114725192,http://www.google.com/search?q=JVC DLA-RS15U Projector,JVC DLA-RS15U Projector
http://catalog.ebay.com/114725422,http://www.google.com/search?q=Sanyo PLCCSE09 Projector,Sanyo PLCCSE09 Projector
http://catalog.ebay.com/114767980,http://www.google.com/search?q=Hitachi CP-AW251NM Projector,Hitachi CP-AW251NM Projector
http://catalog.ebay.com/114728975,http://www.google.com/search?q=Epson Emp821p Projector,Epson Emp821p Projector
http://catalog.ebay.com/114800188,http://www.google.com/search?q=LG DS325B Projector,LG DS325B Projector
http://catalog.ebay.com/114733989,http://www.google.com/search?q=Mitsubishi HC7800DW Projector,Mitsubishi HC7800DW Projector
http://catalog.ebay.com/114693204,http://www.google.com/search?q=BenQ MP620 Projector,BenQ MP620 Projector
http://catalog.ebay.com/114783563,http://www.google.com/search?q=Philips PPX1230 Projector,Philips PPX1230 Projector
http://catalog.ebay.com/114725342,http://www.google.com/search?q=InFocus INF-C315 Projector,InFocus INF-C315 Projector
http://catalog.ebay.com/114691671,http://www.google.com/search?q=Panasonic PT-LB90TEA Projector,Panasonic PT-LB90TEA Projector
http://catalog.ebay.com/114768190,http://www.google.com/search?q=Epson EPSV11H327020 Projector,Epson EPSV11H327020 Projector
http://catalog.ebay.com/114800238,http://www.google.com/search?q=Optoma EH2060 Projector,Optoma EH2060 Projector
http://catalog.ebay.com/114728885,http://www.google.com/search?q=Toshiba TLP 250 Projector,Toshiba TLP 250 Projector
http://catalog.ebay.com/114693504,http://www.google.com/search?q=Eiki LC-XIP2600 Projector,Eiki LC-XIP2600 Projector
http://catalog.ebay.com/114768290,http://www.google.com/search?q=Toshiba TDP-T40U Projector,Toshiba TDP-T40U Projector
http://catalog.ebay.com/114693364,http://www.google.com/search?q=Optoma EP1691i Projector,Optoma EP1691i Projector
http://catalog.ebay.com/114733919,http://www.google.com/search?q=Optoma EW1691e Projector,Optoma EW1691e Projector
http://catalog.ebay.com/114725462,http://www.google.com/search?q=Elmo Projectors CRP-261 Projector,Elmo Projectors CRP-261 Projector
http://catalog.ebay.com/114755077,http://www.google.com/search?q=NEC NP100G Projector,NEC NP100G Projector
http://catalog.ebay.com/114768040,http://www.google.com/search?q=Hitachi CP-X3010E Projector,Hitachi CP-X3010E Projector
http://catalog.ebay.com/114736276,http://www.google.com/search?q=Samsung SP-L255 Projector,Samsung SP-L255 Projector
http://catalog.ebay.com/114733939,http://www.google.com/search?q=Eiki LC-WB200 Projector,Eiki LC-WB200 Projector
http://catalog.ebay.com/114755217,http://www.google.com/search?q=Acer P1266P Projector,Acer P1266P Projector
http://catalog.ebay.com/114706081,http://www.google.com/search?q=Optoma EP726s Projector,Optoma EP726s Projector
http://catalog.ebay.com/114797513,http://www.google.com/search?q=Canon XEED SX700 Projector,Canon XEED SX700 Projector
http://catalog.ebay.com/114782380,http://www.google.com/search?q=Epson EB-1900 Tri-LCD Projector,Epson EB-1900 Tri-LCD Projector
http://catalog.ebay.com/114743325,http://www.google.com/search?q=Sanyo PLC-WXL46 Projector,Sanyo PLC-WXL46 Projector
http://catalog.ebay.com/114706011,http://www.google.com/search?q=Samsung SP-M200S Projector,Samsung SP-M200S Projector
http://catalog.ebay.com/114707434,http://www.google.com/search?q=Canon SX7MM Projector,Canon SX7MM Projector
http://catalog.ebay.com/114750416,http://www.google.com/search?q=Barco R9010350 Projector,Barco R9010350 Projector
http://catalog.ebay.com/114748429,http://www.google.com/search?q=Eiki ST-15211 Projector,Eiki ST-15211 Projector
http://catalog.ebay.com/114707404,http://www.google.com/search?q=Sony VPL-FE40L Projector,Sony VPL-FE40L Projector
http://catalog.ebay.com/114706101,http://www.google.com/search?q=Toshiba TDP-S35U Projector,Toshiba TDP-S35U Projector
http://catalog.ebay.com/114797573,http://www.google.com/search?q=Optoma HD8000-LV Projector,Optoma HD8000-LV Projector
http://catalog.ebay.com/114739582,http://www.google.com/search?q=Christie LX500 Projector,Christie LX500 Projector
http://catalog.ebay.com/114739572,http://www.google.com/search?q=HP MP3800 Projector,HP MP3800 Projector
http://catalog.ebay.com/114743395,http://www.google.com/search?q=Hitachi CP-A100W Projector,Hitachi CP-A100W Projector
http://catalog.ebay.com/114716384,http://www.google.com/search?q=Epson Empx56 LCD Projector,Epson Empx56 LCD Projector
http://catalog.ebay.com/114791170,http://www.google.com/search?q=Barco PresentationPRO (R9860000) Projector,Barco PresentationPRO (R9860000) Projector
http://catalog.ebay.com/114752425,"http://www.google.com/search?q=Acer P3150 SVGA Projector - Ultra Portable, 2000 A Projector","Acer P3150 SVGA Projector - Ultra Portable, 2000 A Projector"
http://catalog.ebay.com/115097342,http://www.google.com/search?q=Optoma HD300X DLP Projector,Optoma HD300X DLP Projector
http://catalog.ebay.com/115103464,http://www.google.com/search?q=FAVI RioHD-LED-4S DLP Projector,FAVI RioHD-LED-4S DLP Projector
http://catalog.ebay.com/115441219,http://www.google.com/search?q=Discovery 1625073 Projector,Discovery 1625073 Projector
http://catalog.ebay.com/115590679,http://www.google.com/search?q=LG HW301G DLP Projector,LG HW301G DLP Projector
http://catalog.ebay.com/66746815,http://www.google.com/search?q=LG RD-JT31 DLP Projector,LG RD-JT31 DLP Projector
http://catalog.ebay.com/66781767,http://www.google.com/search?q=Acer PD 320 DLP Projector,Acer PD 320 DLP Projector
http://catalog.ebay.com/66755748,http://www.google.com/search?q=Sanyo PLC-EF31NL LCD Projector,Sanyo PLC-EF31NL LCD Projector
http://catalog.ebay.com/66712854,http://www.google.com/search?q=Sanyo PLC-XU55 LCD Projector,Sanyo PLC-XU55 LCD Projector
http://catalog.ebay.com/66741552,http://www.google.com/search?q=Acer PD-110 DLP Projector,Acer PD-110 DLP Projector
http://catalog.ebay.com/66747741,http://www.google.com/search?q=Barco iQ G200L LCD Projector,Barco iQ G200L LCD Projector
http://catalog.ebay.com/66766203,http://www.google.com/search?q=Sharp XV-Z12000U DLP Projector,Sharp XV-Z12000U DLP Projector
http://catalog.ebay.com/66764009,http://www.google.com/search?q=Sharp XG-C50U LCD Projector,Sharp XG-C50U LCD Projector
http://catalog.ebay.com/66747781,http://www.google.com/search?q=Epson PowerLite Cinema 200 LCD Projector,Epson PowerLite Cinema 200 LCD Projector
http://catalog.ebay.com/66741662,http://www.google.com/search?q=Panasonic PT-AE500 LCD Projector,Panasonic PT-AE500 LCD Projector
http://catalog.ebay.com/66782147,http://www.google.com/search?q=Hitachi CP-X328OA LCD Projector,Hitachi CP-X328OA LCD Projector
http://catalog.ebay.com/66764279,http://www.google.com/search?q=Yamaha DPX-1100 DLP Projector,Yamaha DPX-1100 DLP Projector
http://catalog.ebay.com/66765710,http://www.google.com/search?q=Acer PD116 DLP Projector,Acer PD116 DLP Projector
http://catalog.ebay.com/66756218,http://www.google.com/search?q=Hitachi CP-S318W LCD Projector,Hitachi CP-S318W LCD Projector
http://catalog.ebay.com/66766593,http://www.google.com/search?q=InFocus ScreenPlay 7210 DLP Projector,InFocus ScreenPlay 7210 DLP Projector
http://catalog.ebay.com/66765780,http://www.google.com/search?q=Christie RoadRunner LX65 LCD Projector,Christie RoadRunner LX65 LCD Projector
http://catalog.ebay.com/66782337,http://www.google.com/search?q=Boxlight CD-726C DLP Projector,Boxlight CD-726C DLP Projector
http://catalog.ebay.com/66713344,http://www.google.com/search?q=JVC DLA-SX21UH LCoS Projector,JVC DLA-SX21UH LCoS Projector
http://catalog.ebay.com/66742042,http://www.google.com/search?q=Acer PD525 DLP Projector,Acer PD525 DLP Projector
http://catalog.ebay.com/66782467,http://www.google.com/search?q=Acer PD116P DLP Projector,Acer PD116P DLP Projector
http://catalog.ebay.com/66756418,http://www.google.com/search?q=BenQ PB6240 DLP Projector,BenQ PB6240 DLP Projector
http://catalog.ebay.com/66756468,http://www.google.com/search?q=Canon LV-7240 LCD Projector,Canon LV-7240 LCD Projector
http://catalog.ebay.com/66747655,http://www.google.com/search?q=Philips Hopper XG20I LCD Projector,Philips Hopper XG20I LCD Projector
http://catalog.ebay.com/66766060,http://www.google.com/search?q=Acer PalmPro 7765PE DLP Projector,Acer PalmPro 7765PE DLP Projector
http://catalog.ebay.com/66782677,http://www.google.com/search?q=Mitsubishi LVP-X50U LCD Projector,Mitsubishi LVP-X50U LCD Projector
http://catalog.ebay.com/66713834,http://www.google.com/search?q=Epson PowerLite 800P LCD Projector,Epson PowerLite 800P LCD Projector
http://catalog.ebay.com/66767113,http://www.google.com/search?q=Sanyo PLC-XU07N LCD Projector,Sanyo PLC-XU07N LCD Projector
http://catalog.ebay.com/66766270,http://www.google.com/search?q=Lightware Legend LX-8 DLP Projector,Lightware Legend LX-8 DLP Projector
http://catalog.ebay.com/66747965,http://www.google.com/search?q=Toshiba TLP X10U LCD Projector,Toshiba TLP X10U LCD Projector
http://catalog.ebay.com/66782957,http://www.google.com/search?q=Sony VPL FE110U LCD Projector,Sony VPL FE110U LCD Projector
http://catalog.ebay.com/66766440,http://www.google.com/search?q=Sharp Notevision PG-M25X DLP Projector,Sharp Notevision PG-M25X DLP Projector
http://catalog.ebay.com/66714114,http://www.google.com/search?q=Panasonic MLP 2000 LCD Projector,Panasonic MLP 2000 LCD Projector
http://catalog.ebay.com/66757078,http://www.google.com/search?q=ASK Proxima DP9200 LCD Projector,ASK Proxima DP9200 LCD Projector
http://catalog.ebay.com/66765249,http://www.google.com/search?q=Panasonic PT-L511XU LCD Projector,Panasonic PT-L511XU LCD Projector
http://catalog.ebay.com/66767443,http://www.google.com/search?q=Sanyo PLC-XF30NL LCD Projector,Sanyo PLC-XF30NL LCD Projector
http://catalog.ebay.com/66748335,http://www.google.com/search?q=Mitsubishi ColorView XL2 LCD Projector,Mitsubishi ColorView XL2 LCD Projector
http://catalog.ebay.com/66753416,http://www.google.com/search?q=Lumens LM 95 LCD Projector,Lumens LM 95 LCD Projector
http://catalog.ebay.com/66714364,http://www.google.com/search?q=Panasonic PT-D7500U DLP Projector,Panasonic PT-D7500U DLP Projector
http://catalog.ebay.com/66743122,http://www.google.com/search?q=3M MP8795L LCD Projector,3M MP8795L LCD Projector
http://catalog.ebay.com/66749321,http://www.google.com/search?q=Compaq Microportable 1800FL DLP Projector,Compaq Microportable 1800FL DLP Projector
http://catalog.ebay.com/66714524,http://www.google.com/search?q=LG LP-XG2 LCD Projector,LG LP-XG2 LCD Projector
http://catalog.ebay.com/66757478,http://www.google.com/search?q=InFocus LP690 LCD Projector,InFocus LP690 LCD Projector
http://catalog.ebay.com/66767030,http://www.google.com/search?q=BenQ PB2220 DLP Projector,BenQ PB2220 DLP Projector
http://catalog.ebay.com/66749481,http://www.google.com/search?q=PLUS Vision Corp. U4-136 DLP Projector,PLUS Vision Corp. U4-136 DLP Projector
http://catalog.ebay.com/66757658,http://www.google.com/search?q=Christie DS+5K DLP Projector,Christie DS+5K DLP Projector
http://catalog.ebay.com/66765879,http://www.google.com/search?q=Sanyo PLV-HD10 LCD Projector,Sanyo PLV-HD10 LCD Projector
http://catalog.ebay.com/66748945,http://www.google.com/search?q=ViewSonic Cine1000 DLP Projector,ViewSonic Cine1000 DLP Projector
http://catalog.ebay.com/66748905,http://www.google.com/search?q=HP xp7030 DLP Projector,HP xp7030 DLP Projector
http://catalog.ebay.com/66768203,http://www.google.com/search?q=BenQ CP120 DLP Projector,BenQ CP120 DLP Projector
http://catalog.ebay.com/66783917,http://www.google.com/search?q=Mitsubishi SD110 DLP Projector,Mitsubishi SD110 DLP Projector
http://catalog.ebay.com/66768333,http://www.google.com/search?q=Christie LW40U LCD Projector,Christie LW40U LCD Projector
http://catalog.ebay.com/66749821,http://www.google.com/search?q=Christie LX37 LCD Projector,Christie LX37 LCD Projector
http://catalog.ebay.com/66768343,http://www.google.com/search?q=NEC XT5100 DLP Projector,NEC XT5100 DLP Projector
http://catalog.ebay.com/66757888,http://www.google.com/search?q=Hitachi CP-X327 LCD Projector,Hitachi CP-X327 LCD Projector
http://catalog.ebay.com/66749195,http://www.google.com/search?q=Boxlight CP-775i LCD Projector,Boxlight CP-775i LCD Projector
http://catalog.ebay.com/66744022,http://www.google.com/search?q=Boxlight XP-5t LCD Projector,Boxlight XP-5t LCD Projector
http://catalog.ebay.com/66743872,http://www.google.com/search?q=Optoma DX733 DLP Projector,Optoma DX733 DLP Projector
http://catalog.ebay.com/66715264,http://www.google.com/search?q=Boxlight TraveLight DLP Projector,Boxlight TraveLight DLP Projector
http://catalog.ebay.com/66768453,http://www.google.com/search?q=Liesegang DV-465 LCD Projector,Liesegang DV-465 LCD Projector
http://catalog.ebay.com/66758068,http://www.google.com/search?q=Boxlight RAVEN XB DLP Projector,Boxlight RAVEN XB DLP Projector
http://catalog.ebay.com/66768693,http://www.google.com/search?q=Dukane ImagePro 9060 LCD Projector,Dukane ImagePro 9060 LCD Projector
http://catalog.ebay.com/66715354,http://www.google.com/search?q=Eiki EIP-3000N DLP Projector,Eiki EIP-3000N DLP Projector
http://catalog.ebay.com/66754486,http://www.google.com/search?q=Eiki LC-XT4U LCD Projector,Eiki LC-XT4U LCD Projector
http://catalog.ebay.com/66749395,http://www.google.com/search?q=Eiki LC-W4 LCD Projector,Eiki LC-W4 LCD Projector
http://catalog.ebay.com/66766579,http://www.google.com/search?q=Eiki LC-XNB4 LCD Projector,Eiki LC-XNB4 LCD Projector
http://catalog.ebay.com/66715604,http://www.google.com/search?q=NEC MultiSync LT25 DLP Projector,NEC MultiSync LT25 DLP Projector
http://catalog.ebay.com/66758558,http://www.google.com/search?q=Toshiba TDP-TW95 DLP Projector,Toshiba TDP-TW95 DLP Projector
http://catalog.ebay.com/66744432,http://www.google.com/search?q=3M DMS-710 DLP Projector,3M DMS-710 DLP Projector
http://catalog.ebay.com/66769003,http://www.google.com/search?q=Sanyo PLC-XL50 LCD Projector,Sanyo PLC-XL50 LCD Projector
http://catalog.ebay.com/66749825,http://www.google.com/search?q=Mitsubishi FL7000U LCD Projector,Mitsubishi FL7000U LCD Projector
http://catalog.ebay.com/66769043,http://www.google.com/search?q=Sanyo PLC-WXU30 LCD Projector,Sanyo PLC-WXU30 LCD Projector
http://catalog.ebay.com/66768300,http://www.google.com/search?q=Toshiba TDP-EW25U DLP Projector,Toshiba TDP-EW25U DLP Projector
#N/A,http://www.google.com/search?q=BenQ CP220 DLP Projector,BenQ CP220 DLP Projector
http://catalog.ebay.com/66715864,http://www.google.com/search?q=InFocus IN12 DLP Projector,InFocus IN12 DLP Projector
http://catalog.ebay.com/66766939,http://www.google.com/search?q=Epson EMP-1810 LCD Projector,Epson EMP-1810 LCD Projector
http://catalog.ebay.com/66769163,http://www.google.com/search?q=Toshiba TDP-BSC8U Projector,Toshiba TDP-BSC8U Projector
http://catalog.ebay.com/66758928,http://www.google.com/search?q=Samsung SP-H800BE DLP Projector,Samsung SP-H800BE DLP Projector
http://catalog.ebay.com/66750145,http://www.google.com/search?q=Select Products P5024 Projector,Select Products P5024 Projector
http://catalog.ebay.com/70541200,http://www.google.com/search?q=Sanyo PDG-DSU20N DLP Projector,Sanyo PDG-DSU20N DLP Projector
http://catalog.ebay.com/71110241,http://www.google.com/search?q=Sanyo PLC-XW60 LCD Projector,Sanyo PLC-XW60 LCD Projector
http://catalog.ebay.com/72074811,http://www.google.com/search?q=Panasonic PT-L712 LCD Projector,Panasonic PT-L712 LCD Projector
http://catalog.ebay.com/72081025,http://www.google.com/search?q=Panasonic PT-L702 LCD Projector,Panasonic PT-L702 LCD Projector
http://catalog.ebay.com/72089739,http://www.google.com/search?q=Hitachi CP-X870D LCD Projector,Hitachi CP-X870D LCD Projector
http://catalog.ebay.com/72100608,http://www.google.com/search?q=Haicom HI-408 BT Projector,Haicom HI-408 BT Projector
http://catalog.ebay.com/72100588,http://www.google.com/search?q=VIO Technology VIO330 Projector,VIO Technology VIO330 Projector
http://catalog.ebay.com/72126637,http://www.google.com/search?q=Hitachi CP-WX625 LCD Projector,Hitachi CP-WX625 LCD Projector
http://catalog.ebay.com/77253986,http://www.google.com/search?q=Acer PD323 DLP Projector,Acer PD323 DLP Projector
http://catalog.ebay.com/77858020,http://www.google.com/search?q=Optoma DX606 DLP Projector,Optoma DX606 DLP Projector
http://catalog.ebay.com/78632560,http://www.google.com/search?q=InFocus IN5534 DLP Projector,InFocus IN5534 DLP Projector
http://catalog.ebay.com/79086684,http://www.google.com/search?q=Sanyo PLV-Z700 LCD Projector,Sanyo PLV-Z700 LCD Projector
http://catalog.ebay.com/79130176,http://www.google.com/search?q=Epson Powerlite 2200 LCD Projector,Epson Powerlite 2200 LCD Projector
http://catalog.ebay.com/80879967,http://www.google.com/search?q=Electrohome Marquee 9500LC CRT Projector,Electrohome Marquee 9500LC CRT Projector
http://catalog.ebay.com/82007183,http://www.google.com/search?q=Dell 4610X DLP Projector,Dell 4610X DLP Projector
http://catalog.ebay.com/82006449,http://www.google.com/search?q=Mitsubishi XD470U DLP Projector,Mitsubishi XD470U DLP Projector
http://catalog.ebay.com/81944584,http://www.google.com/search?q=Epson PowerLite 7500C LCD Projector,Epson PowerLite 7500C LCD Projector
http://catalog.ebay.com/82041777,http://www.google.com/search?q=JVC DLA-RS1 LCoS Projector,JVC DLA-RS1 LCoS Projector
http://catalog.ebay.com/82848189,http://www.google.com/search?q=Panasonic PT-LB50NTU LCD Projector,Panasonic PT-LB50NTU LCD Projector
http://catalog.ebay.com/82848139,http://www.google.com/search?q=NEC MultiSync LT280 LCD Projector,NEC MultiSync LT280 LCD Projector
http://catalog.ebay.com/82838906,http://www.google.com/search?q=ViewSonic HC3800 Projector,ViewSonic HC3800 Projector
http://catalog.ebay.com/85302840,http://www.google.com/search?q=Vivitek D927TW DLP Projector,Vivitek D927TW DLP Projector
http://catalog.ebay.com/85279573,http://www.google.com/search?q=Canon 4328B002 Projector,Canon 4328B002 Projector
http://catalog.ebay.com/85306507,http://www.google.com/search?q=Panasonic PT-D6000ULS DLP Projector,Panasonic PT-D6000ULS DLP Projector
http://catalog.ebay.com/85306108,http://www.google.com/search?q=Panasonic PT-LB90U LCD Projector,Panasonic PT-LB90U LCD Projector
http://catalog.ebay.com/92272283,http://www.google.com/search?q=HP L1708A Projector,HP L1708A Projector
http://catalog.ebay.com/92380299,http://www.google.com/search?q=InFocus Pro AV 9550 LCD Projector,InFocus Pro AV 9550 LCD Projector
http://catalog.ebay.com/92397826,http://www.google.com/search?q=Toshiba TDP-S80U DLP Projector,Toshiba TDP-S80U DLP Projector
http://catalog.ebay.com/92440848,http://www.google.com/search?q=Samsung L300 LCD Projector,Samsung L300 LCD Projector
http://catalog.ebay.com/93716064,http://www.google.com/search?q=Planar PD7060 DLP Projector,Planar PD7060 DLP Projector
http://catalog.ebay.com/93813488,http://www.google.com/search?q=BenQ CP220 DLP Projector,BenQ CP220 DLP Projector
http://catalog.ebay.com/94187339,http://www.google.com/search?q=Hitachi CP-WX11000 LCD Projector,Hitachi CP-WX11000 LCD Projector
http://catalog.ebay.com/97467944,http://www.google.com/search?q=Sharp XG-E650UB LCD Projector,Sharp XG-E650UB LCD Projector
http://catalog.ebay.com/97514359,http://www.google.com/search?q=InFocus LP 580 LCD Projector,InFocus LP 580 LCD Projector
http://catalog.ebay.com/97505302,http://www.google.com/search?q=Toshiba TLP-671 LCD Projector,Toshiba TLP-671 LCD Projector
http://catalog.ebay.com/99208921,http://www.google.com/search?q=InFocus LP630 LCD Projector,InFocus LP630 LCD Projector
http://catalog.ebay.com/99260497,http://www.google.com/search?q=NCO LED930 LCD Projector,NCO LED930 LCD Projector
http://catalog.ebay.com/99162044,http://www.google.com/search?q=Sharp XG-E850U LCD Projector,Sharp XG-E850U LCD Projector
http://catalog.ebay.com/99245160,http://www.google.com/search?q=Smart Tech UF55 DLP Projector,Smart Tech UF55 DLP Projector
http://catalog.ebay.com/101904196,http://www.google.com/search?q=Sanyo PLC-XW20 LCD Projector,Sanyo PLC-XW20 LCD Projector
http://catalog.ebay.com/101904246,http://www.google.com/search?q=InFocus RP10s LCD Projector,InFocus RP10s LCD Projector
http://catalog.ebay.com/101953838,http://www.google.com/search?q=NEC MultiSync LT240 DLP Projector,NEC MultiSync LT240 DLP Projector
http://catalog.ebay.com/101893631,http://www.google.com/search?q=BenQ HT 480W DLP Projector,BenQ HT 480W DLP Projector
http://catalog.ebay.com/101849684,http://www.google.com/search?q=Epson 1220 LCD Projector,Epson 1220 LCD Projector
http://catalog.ebay.com/101889562,http://www.google.com/search?q=Christie Vivid Red Projector,Christie Vivid Red Projector
http://catalog.ebay.com/101889572,http://www.google.com/search?q=Epson EMP-TS10 LCD Projector,Epson EMP-TS10 LCD Projector
http://catalog.ebay.com/101904396,http://www.google.com/search?q=InFocus IN26+EP DLP Projector,InFocus IN26+EP DLP Projector
http://catalog.ebay.com/101895355,http://www.google.com/search?q=Mitsubishi SD200 DLP Projector,Mitsubishi SD200 DLP Projector
http://catalog.ebay.com/101954008,http://www.google.com/search?q=Knoll HT211 DLP Projector,Knoll HT211 DLP Projector
http://catalog.ebay.com/101895365,http://www.google.com/search?q=Sanyo PLC-SP20N LCD Projector,Sanyo PLC-SP20N LCD Projector
http://catalog.ebay.com/101895375,http://www.google.com/search?q=Canon LV-7350 LCD Projector,Canon LV-7350 LCD Projector
http://catalog.ebay.com/101893801,http://www.google.com/search?q=ViewSonic LiteBird LCD Projector,ViewSonic LiteBird LCD Projector
http://catalog.ebay.com/101895385,http://www.google.com/search?q=Sharp Notevision PG-M10X DLP Projector,Sharp Notevision PG-M10X DLP Projector
http://catalog.ebay.com/101950817,http://www.google.com/search?q=Epson EMP-53 LCD Projector,Epson EMP-53 LCD Projector
http://catalog.ebay.com/101950777,http://www.google.com/search?q=NEC NP-U310W DLP Projector,NEC NP-U310W DLP Projector
http://catalog.ebay.com/101925573,http://www.google.com/search?q=PLUS Vision Corp. U2 X2000 DLP Projector,PLUS Vision Corp. U2 X2000 DLP Projector
http://catalog.ebay.com/101849874,http://www.google.com/search?q=InFocus DP6860 Plus Projector,InFocus DP6860 Plus Projector
http://catalog.ebay.com/101950847,http://www.google.com/search?q=Lumens DC80A Projector,Lumens DC80A Projector
http://catalog.ebay.com/101889652,http://www.google.com/search?q=Epson D6250 LCD Projector,Epson D6250 LCD Projector
http://catalog.ebay.com/102355060,http://www.google.com/search?q=Optoma TW330 DLP Projector,Optoma TW330 DLP Projector
http://catalog.ebay.com/102375017,http://www.google.com/search?q=Samsung SP-M250W LCD Projector,Samsung SP-M250W LCD Projector
http://catalog.ebay.com/102317291,http://www.google.com/search?q=3M X95I DLP Projector,3M X95I DLP Projector
http://catalog.ebay.com/102316952,http://www.google.com/search?q=Mitsubishi XL6600LU LCD Projector,Mitsubishi XL6600LU LCD Projector
