Task ID,Client,Campaign,Channel,Tier: Order,Title,Direction,Resource Link 1,Resource Link 2,Resource Link 3,Desired Placement,Anchor Text,Target URL,Website Example,Client Comment,Extra Writer Notes
38863,LHMR (LHMR),MIX339002 Vaporcade Dec 15,lcolarado1,Budget,38863 - ,,,,,infotainmentnews.net,Branded,Beware of Free Electronic Cigaratte Offers: How to Avoid Getting Scammed,,,
38864,LHMR (LHMR),MIX339002 Vaporcade Dec 15,lcolarado1,Budget,38864 - ,,,,,fooyoh.com,Branded,Can I buy e-cigarettes Without Nicotine,,,
38865,LHMR (LHMR),MIX339002 Vaporcade Dec 15,lcolarado1,Budget,38865 - ,,,,,lerablog.org,Branded,Control Your Nicotine: The Benefits of Vaping,,,
38873,LHMR (LHMR),MIX339002 Vaporcade Dec 15,lcolarado1,Budget,38873 - ,,,,,techpatio.com,Branded,A Closer Look Are Electronic Cigarettes Harmful,,,
38875,LHMR (LHMR),MIX339002 Vaporcade Dec 15,lcolarado1,Budget,38875 - ,,,,,techgyo.com,Branded,The Smokin Age Debate: Is 18 Old Enough,,,
